address,name
대한민국 서울특별시 용산구 동자동 청파로 378,서울역
대한민국 서울특별시 중구 소공동 지하 101,시청
대한민국 서울특별시 종로구 종로 지하 55,종각
대한민국 서울특별시 종로구 종로1.2.3.4가동,종로3가
대한민국 서울특별시 종로구 종로 지하 216,종로5가
대한민국 서울특별시 종로구 종로 302,동대문
대한민국 서울특별시 동대문구 신설동,신설동
대한민국 서울특별시 동대문구 용신동,제기동
대한민국 서울특별시 동대문구 전농1동,청량리
대한민국 서울특별시 종로구 숭인2동,동묘앞
대한민국 서울특별시 중구 소공동 지하 101,시청
대한민국 서울특별시 중구 을지로동 42,을지로입구
대한민국 서울특별시 을지로3가,을지로3가
대한민국 서울특별시 중구 을지로동,을지로4가
대한민국 서울특별시 중구 을지로동 279,동대문역사문화공원
대한민국 서울특별시 중구 황학동,신당
대한민국 서울특별시 성동구 왕십리로 지하 374,상왕십리
대한민국 서울특별시 성동구 왕십리로 지하 300,왕십리
대한민국 서울특별시 성동구 사근동,한양대
대한민국 서울특별시 성동구 성수1가2동,뚝섬
대한민국 서울특별시 성동구 성수동2가,성수
대한민국 서울특별시 광진구 화양동,건대입구
대한민국 서울특별시 광진구 자양2동 216-22,구의
대한민국 서울특별시 광진구 구의3동 강변역로 53,강변
대한민국 서울특별시 송파구 오금로 20,잠실나루
대한민국 서울특별시 송파구 잠실6동,잠실
대한민국 서울특별시 송파구 잠실동,신천
대한민국 서울특별시 송파구 잠실7동,종합운동장
대한민국 서울특별시 강남구,삼성
대한민국 서울특별시 강남구 역삼동,선릉
대한민국 서울특별시 강남구,역삼
대한민국 서울특별시 강남구 역삼1동 강남대로 지하396,강남
대한민국 서울특별시 서초구 서초동,교대
대한민국 서울특별시 서초구 서초3동,서초
대한민국 서울특별시 서초구,방배
대한민국 서울특별시 관악구 남부순환로,사당
대한민국 서울특별시 관악구 봉천동,낙성대
대한민국 서울특별시 관악구 봉천동,서울대입구
대한민국 서울특별시 관악구 봉천동,봉천
대한민국 서울특별시 관악구,신림
대한민국 서울특별시 동작구 대림로 2,신대방
대한민국 서울특별시 구로구 대림2동 도림천로 477,구로디지털단지
대한민국 서울특별시 영등포구,대림
대한민국 서울특별시 구로구 신도림동,신도림
대한민국 서울특별시 영등포구,문래
대한민국 서울특별시 영등포구 당산1동 당산로 123,영등포구청
대한민국 서울특별시 영등포구 당산2동,당산
대한민국 서울특별시 마포구 합정동,합정
대한민국 서울특별시 마포구 동교동,홍대입구
대한민국 서울특별시 서대문구,신촌
대한민국 서울특별시 마포구 서교동 와우산로 180,이대
대한민국 서울특별시 마포구 신촌로 270,아현
대한민국 서울특별시 서대문구 충현동,충정로
대한민국 서울특별시 성동구 사근동,용답
대한민국 서울특별시 성동구 천호대로 232,신답
대한민국 서울특별시 동대문구 신설동,신설동
대한민국 서울특별시 구로구 신도림동,도림천
대한민국 서울특별시 양천구 신정7동,양천구청
대한민국 서울특별시 양천구 신정동,신정네거리
대한민국 서울특별시 동대문구 용신동,용두
대한민국 경기도 고양시 덕양구 지축동,지축
대한민국 서울특별시 은평구 진관동,구파발
대한민국 서울특별시 은평구 갈현1동,연신내
대한민국 서울특별시 은평구,불광
대한민국 서울특별시 은평구 통일로 지하 602-1,녹번
대한민국 서울특별시 서대문구 홍제동,홍제
대한민국 서울특별시 서대문구 홍제동,무악재
대한민국 서울특별시 서대문구 통일로 지하 247,독립문
대한민국 서울특별시 종로구 종로1.2.3.4가동 사직로 161,경복궁
대한민국 서울특별시 종로구 율곡로 지하 62,안국
대한민국 서울특별시 종로구 종로1.2.3.4가동,종로3가
대한민국 서울특별시 을지로3가,을지로3가
대한민국 서울특별시 중구 장충동2가,동대입구
대한민국 서울특별시 중구 신당동,약수
대한민국 서울특별시 성동구 동호로 지하 104,금호
대한민국 서울특별시 성동구 옥수동,옥수
대한민국 서울특별시 강남구,압구정
대한민국 서울특별시 강남구,신사
대한민국 서울특별시 서초구 잠원동,잠원
대한민국 서울특별시 서초구 반포동 신반포로 194,고속터미널
대한민국 서울특별시 서초구 서초동,교대
대한민국 서울특별시 서초구 서초동,남부터미널
대한민국 서울특별시 서초구 양재1동,양재
대한민국 서울특별시 강남구 도곡동,매봉
대한민국 서울특별시 강남구 남부순환로 지하 2814,도곡
대한민국 서울특별시 강남구 대치동,대치
대한민국 서울특별시 강남구 대치동,학여울
대한민국 서울특별시 강남구 일원2동,대청
대한민국 서울특별시 강남구 일원동,일원
대한민국 서울특별시 강남구 수서동,수서
대한민국 서울특별시 송파구,가락시장
대한민국 서울특별시 송파구 가락동,경찰병원
대한민국 서울특별시 송파구 오금로 지하 321,오금
대한민국 서울특별시 노원구 상계3.4동,당고개
대한민국 서울특별시 노원구,상계
대한민국 서울특별시 노원구 상계6.7동,노원
대한민국 서울특별시 도봉구,창동
대한민국 서울특별시 도봉구,쌍문
대한민국 서울특별시 강북구 도봉로 지하 338,수유
대한민국 서울특별시 강북구 미아동,미아
대한민국 서울특별시 강북구 미아동,미아사거리
대한민국 서울특별시 성북구,길음
대한민국 서울특별시 성북구 동선동,성신여대입구
대한민국 서울특별시 성북구 삼선동3가 삼선교로16길 13,한성대입구
대한민국 서울특별시 종로구,혜화
대한민국 서울특별시 종로구 율곡로 지하 308,동대문
대한민국 서울특별시 중구 을지로동 279,동대문역사문화공원
대한민국 서울특별시 중구 필동2가,충무로
대한민국 서울특별시 중구 명동,명동
대한민국 서울특별시 중구 퇴계로 386-5,회현
대한민국 서울특별시 용산구 동자동 청파로 378,서울역
대한민국 서울특별시 용산구 한강대로 306,숙대입구
대한민국 서울특별시 용산구 한강로1가,삼각지
대한민국 서울특별시 용산구 한강로2가,신용산
대한민국 서울특별시 용산구,이촌
대한민국 서울특별시 동작구 동작동,동작
대한민국 서울특별시 동작구 사당2동,총신대입구
대한민국 서울특별시 동작구 사당1동 동작대로3길,사당
대한민국 서울특별시 서초구 과천대로 지하 816,남태령
대한민국 서울특별시 강서구,방화
대한민국 서울특별시 강서구 방화동,개화산
대한민국 서울특별시 강서구 방화2동,김포공항
대한민국 서울특별시 강서구 공항동,송정
대한민국 서울특별시 강서구 가양1동,마곡
대한민국 서울특별시 강서구 공항대로 지하 267,발산
대한민국 서울특별시 강서구 강서로 지하 262,우장산
대한민국 서울특별시 강서구,화곡
대한민국 서울특별시 강서구 화곡동,까치산
대한민국 서울특별시 양천구 신정4동,신정
대한민국 서울특별시 양천구 오목로 지하 245,목동
대한민국 서울특별시 양천구 목1동,오목교
대한민국 서울특별시 영등포구 양산로 지하 21,양평
대한민국 서울특별시 영등포구 당산1동 당산로 123,영등포구청
대한민국 서울특별시 영등포구,영등포시장
대한민국 서울특별시 영등포구 경인로114가길 지하 9,신길
대한민국 서울특별시 영등포구 여의동,여의도
대한민국 서울특별시 영등포구 여의동,여의나루
대한민국 서울특별시 마포구 도화동,마포
대한민국 서울특별시 마포구 마포대로 지하 100,공덕
대한민국 서울특별시 마포구 공덕동,애오개
대한민국 서울특별시 서대문구 충현동,충정로
대한민국 서울특별시 서대문구 충정로2가,서대문
대한민국 서울특별시 종로구 세종대로 지하 172,광화문
대한민국 서울특별시 종로구 종로1.2.3.4가동,종로3가
대한민국 서울특별시 중구 을지로동,을지로4가
대한민국 서울특별시 중구 을지로동 279,동대문역사문화공원5
대한민국 서울특별시 중구 신당동,청구
대한민국 서울특별시 성동구 금호로 지하 154,신금호
대한민국 서울특별시 성동구 사근동,행당
대한민국 서울특별시 성동구 왕십리로 지하 300,왕십리
대한민국 서울특별시 성동구 마장동,마장
대한민국 서울특별시 동대문구 답십리1동,답십리
대한민국 서울특별시 동대문구,장한평
대한민국 서울특별시 광진구 천호대로 지하 550,군자
대한민국 서울특별시 광진구 구의2동,아차산
대한민국 서울특별시 광진구 광장동,광나루
대한민국 서울특별시 강동구,천호
대한민국 서울특별시 강동구 천호대로 지하 1097,강동
대한민국 서울특별시 강동구 길동,길동
대한민국 서울특별시 강동구 양재대로 지하 1572,굽은다리
대한민국 서울특별시 강동구,명일
대한민국 서울특별시 강동구 고덕로 지하 253,고덕
대한민국 서울특별시 강동구 상일동,상일동
대한민국 서울특별시 강동구 양재대로 지하 1369,둔촌동
대한민국 서울특별시 송파구 방이동,올림픽공원
대한민국 서울특별시 송파구,방이
대한민국 서울특별시 송파구 오금로 지하 321,오금
대한민국 서울특별시 송파구 가락동,개롱
대한민국 서울특별시 송파구,거여
대한민국 서울특별시 송파구 마천1동,마천
대한민국 서울특별시 은평구 증산로 지하 477,응암
대한민국 서울특별시 은평구 역촌동,역촌
대한민국 서울특별시 은평구,불광
대한민국 서울특별시 은평구 불광동,독바위
대한민국 서울특별시 은평구 역촌동,구산
대한민국 서울특별시 은평구 신사2동,새절
대한민국 서울특별시 은평구 증산동,증산
대한민국 서울특별시 은평구 수색로 지하 175,디지털미디어시티
대한민국 서울특별시 마포구 성산2동,월드컵경기장
대한민국 서울특별시 마포구 성산2동,마포구청
대한민국 서울특별시 마포구,망원
대한민국 서울특별시 마포구 합정동,합정
대한민국 서울특별시 마포구,상수
대한민국 서울특별시 마포구 독막로 165,광흥창
대한민국 서울특별시 마포구 대흥동,대흥
대한민국 서울특별시 마포구 백범로 지하 200,공덕
대한민국 서울특별시 용산구 백범로 287,효창공원앞
대한민국 서울특별시 용산구 한강로1가,삼각지
대한민국 서울특별시 용산구 용산2가동,녹사평
대한민국 서울특별시 용산구 이태원1동 녹사평대로46길 16,이태원
대한민국 서울특별시 용산구 한남동,한강진
대한민국 서울특별시 중구 신당동,버티고개
대한민국 서울특별시 중구 신당동,약수
대한민국 서울특별시 중구 신당동,청구
대한민국 서울특별시 중구 황학동,신당
대한민국 서울특별시 종로구 숭인2동,동묘앞
대한민국 서울특별시 종로구 창신동,창신
대한민국 서울특별시 성북구,보문
대한민국 서울특별시 성북구,안암
대한민국 서울특별시 성북구 종암동,고려대
대한민국 서울특별시 성북구 월곡2동,월곡
대한민국 서울특별시 성북구 상월곡동,상월곡
대한민국 서울특별시 성북구 화랑로 지하 243,돌곶이
대한민국 서울특별시 노원구 화랑로 지하 347-1,석계
대한민국 서울특별시 노원구 공릉1동,태릉입구
대한민국 서울특별시 노원구 공릉2동,화랑대
대한민국 서울특별시 중랑구,봉화산
대한민국 경기도 의정부시 장암동,장암
대한민국 서울특별시 도봉구 도봉동,도봉산
대한민국 서울특별시 노원구 상계동,수락산
대한민국 서울특별시 노원구 상계동,마들
대한민국 서울특별시 노원구 상계6.7동,노원
대한민국 서울특별시 노원구,중계
대한민국 서울특별시 노원구,하계
대한민국 서울특별시 노원구,공릉
대한민국 서울특별시 노원구 공릉1동,태릉입구
대한민국 서울특별시 중랑구 묵동,먹골
대한민국 서울특별시 중랑구,중화
대한민국 서울특별시 중랑구 상봉2동,상봉
대한민국 서울특별시 중랑구 면목동,면목
대한민국 서울특별시 중랑구 면목동,사가정
대한민국 서울특별시 중랑구 면목4동,용마산
대한민국 서울특별시 광진구 중곡3동,중곡
대한민국 서울특별시 광진구 천호대로 지하 550,군자
대한민국 서울특별시 광진구 군자동,어린이대공원
대한민국 서울특별시 광진구 화양동,건대입구
대한민국 서울특별시 광진구 자양동 능동로 10,뚝섬유원지
대한민국 서울특별시 강남구 학동로 지하 508,청담
대한민국 서울특별시 강남구 학동로 지하 346,강남구청
대한민국 서울특별시 강남구,학동
대한민국 서울특별시 강남구 학동로 지하 102,논현
대한민국 서울특별시 서초구 잠원동,반포
대한민국 서울특별시 서초구 반포동 신반포로 194,고속터미널
대한민국 서울특별시 서초구 방배동,내방
대한민국 서울특별시 동작구 사당2동,이수
대한민국 서울특별시 동작구,남성
대한민국 서울특별시 동작구 상도1동,숭실대입구
대한민국 서울특별시 동작구,상도
대한민국 서울특별시 동작구 상도2동,장승배기
대한민국 서울특별시 동작구 대방동,신대방삼거리
대한민국 서울특별시 동작구 상도로,보라매
대한민국 서울특별시 영등포구 신길동,신풍
대한민국 서울특별시 영등포구,대림
대한민국 서울특별시 구로구 도림로 7,남구로
대한민국 서울특별시 금천구 벚꽃로 309,가산디지털단지
대한민국 경기도 광명시 철산로 철산3동 57 주공아파트 1308동,철산
대한민국 경기도 광명시 광명동,광명사거리
대한민국 서울특별시 구로구 오류2동,천왕
대한민국 서울특별시 구로구 수궁동,온수
대한민국 경기도 부천시 원미구 길주로,까치울
대한민국 경기도 부천시 원미구 춘의동,부천종합운동장
대한민국 경기도 부천시 원미구 춘의동,춘의
대한민국 경기도 부천시 원미구 중3동,신중동
대한민국 경기도 부천시 원미구 길주로,부천시청
대한민국 경기도 부천시 원미구 심곡2동 156-1,상동
대한민국 인천광역시 부평구 길주로,삼산체육관
대한민국 인천광역시 부평구 갈산2동,굴포천
대한민국 인천광역시 부평구 부평대로 지하 189,부평구청
대한민국 서울특별시 강동구,암사
대한민국 서울특별시 강동구,천호
대한민국 서울특별시 강동구 성내1동 성내로 25,강동구청
대한민국 서울특별시 송파구 올림픽로 지하 383,몽촌토성
대한민국 서울특별시 송파구 잠실6동,잠실
대한민국 서울특별시 송파구 송파동,석촌
대한민국 서울특별시 송파구 송파대로 지하 354,송파
대한민국 서울특별시 송파구,가락시장
대한민국 서울특별시 송파구,문정
대한민국 서울특별시 송파구 문정2동,장지
대한민국 서울특별시 송파구 장지동,복정
대한민국 경기도 성남시 수정구 신흥동,산성
대한민국 경기도 성남시 수정구 단대동,남한산성입구
대한민국 경기도 성남시 수정구 산성대로 지하 365,단대오거리
대한민국 경기도 성남시 수정구 신흥3동,신흥
대한민국 경기도 성남시 수정구 신흥1동,수진
대한민국 경기도 성남시 중원구 성남동,모란
대한민국 서울특별시 송파구 잠실동,잠실새내
대한민국 서울특별시 성북구,보문
대한민국 서울특별시 은평구 갈현1동,연신내
